Sheet: REGISTROORDENDETRANSFEREN
A1: Proyecto E SAS
A2: Holding Laika : Laika Colombia
A3: REGISTRO ORDEN DE TRANSFERENCIA PRODUCTO ENVIADO
A4: 1 febrero 2020 - 30 julio 2025
A6: Opciones: Mostrar ceros
A7: Número de documento | B7: SKU ARTICULO | C7: NOMBRE ARTICULO | D7: Cantidad | E7: Un Enviada
A8: Laika/Cajica/Disponible
A9: VE20966
B10: 7709465690001 | C10: King Cat - Arena Sanitaria - 4.5 KG | D10: 1.0
B11: 7707196565322 | C11: Freemiau - Arena Para Gato - 4.5 KG | D11: 4.0
B12: 7709355546425 | C12: MAÍZ CAT - Arena de Maíz Para Gato - 4 KG | D12: 48.0 | E12: 48.0
B13: 7709214028840 | C13: Foficat - Arena Para Gatos - 10 KG | D13: 13.0 | E13: 13.0
B14: 3030301000143 | C14: Hakuna Natural - Arena Aglomerante Premium - Combo | D14: 3.0 | E14: 3.0
B15: 7703090961031 | C15: Mirringo - Arena para gatos - 10 KG | D15: 12.0 | E15: 12.0
B16: 781159635267 | C16: Jv Cats - Arena Sanitaria Fresa - 5 Kg | D16: 1.0 | E16: 1.0
B17: 781159451249 | C17: Jv Cats - Arena Sanitaria Manzana - 20 KG | D17: 5.0 | E17: 5.0
B18: 7709214028864 | C18: Canada Litter - Arena Para Gato - 4.5 KG | D18: 8.0 | E18: 8.0
B19: 7643758155900 | C19: Arena Ecológica FELINE PINE - 10 KG | D19: 11.0 | E19: 11.0
B20: 788070718291 | C20: Hakuna Natural - Arena Aglomerante Premium - 10 KG | D20: 4.0 | E20: 4.0
B21: 7708808596369 | C21: Foficat - Arena Aroma Carbón Activado - 5 kg | D21: 1.0 | E21: 1.0
B22: 7707196563601 | C22: Arena Freemiau Cítrica - 4 KG | D22: 3.0 | E22: 3.0
B23: 788070734192 | C23: Furry - Arena Super Premium para Gato Carbón Activado - 6.35 KG | D23: 5.0 | E23: 5.0
B24: 044600304687 | C24: Fresh Step - Arena Multi Cat con Frebreze - 25 LB | D24: 28.0 | E24: 28.0
B25: 7708638091034 | C25: Furry - Arena Premium Aglomerante - 4.5 KG | D25: 1.0 | E25: 1.0
B26: 7708808596987 | C26: Foficat - Arena Aroma Café - 5 kg | D26: 2.0 | E26: 2.0
B27: 044600020495 | C27: Fresh Step - Arena Multi Cat con Frebreze - 14 LB | D27: 4.0 | E27: 4.0
B28: 7707865300087 | C28: Furry – Arena Aglomerante Gato Precio Especial - 10 KG | D28: 12.0 | E28: 12.0
B29: 781159451225 | C29: Jv Cats - Arena Sanitaria Lavanda - 5 KG | D29: 3.0 | E29: 3.0
B30: 7643758155696 | C30: Feline Pine - Arena Ecológica para gato - 5 KG | D30: 3.0
B31: 7709052836393 | C31: Foficat - Arena Con Aroma Lavanda - 5 KG | D31: 3.0 | E31: 3.0
B32: 29534752154 | C32: Furry - Arena Aglomerante - 4.5 KG | D32: 8.0 | E32: 8.0
B33: 781159562211 | C33: Jv Cats - Arena Sanitaria Manzana - 5 KG | D33: 4.0 | E33: 4.0
B34: 781159451218 | C34: Jv Cats - Arena Sanitaria Café - 5 KG | D34: 9.0 | E34: 9.0
B35: 788070734178 | C35: Furry Blue - Arena Aglomerante Super Premium - 10 KG | D35: 5.0 | E35: 5.0
B36: 7709355546487 | C36: MAÍZ CAT - Arena de Maíz Para Gato - 10 KG | D36: 47.0 | E36: 47.0
B37: 3030301000144 | C37: Furry - Combo 2 Arenas Aglomerantes Premium Furry Black - Combo | D37: 2.0 | E37: 2.0
B38: 788070734185 | C38: Hakuna Sello Azul - Arena Aglomerante Super Premium - 10 KG | D38: 3.0 | E38: 3.0
A39: Total - VE20966 | D39: SUM(R[-29]C:R[-1]C) -> 253.0 | E39: SUM(R[-29]C:R[-1]C) -> 245.0
A40: Total - Laika/Cajica/Disponible | D40: SUM(R[-1]C) -> 253.0 | E40: SUM(R[-1]C) -> 245.0
A41: Total | D41: SUM(R[-1]C) -> 253.0 | E41: SUM(R[-1]C) -> 245.0